{
  "nodeId": "NODE-VPU-META",
  "kind": "VPU",
  "ownerOrg": "ORG-META",
  "label": "비전·AI인식",
  "role": "카메라·객체/작물/사람 인식",
  "signals": ["machine.vision.fps", "machine.vision.framedrop", "machine.vision.worker_detected"],
  "commands": ["vision.capture.start", "vision.capture.stop", "vision.calibrate"],
  "protocolRef": "PRT-MQTT-v2"
}
